{"cycle_id":"mock-002","ended_at":"2026-10-30T07:05:37.459413+00:00","history":[{"cycle_id":"mock-001","ended_at":"2026-10-30T07:05:37.425558+00:00","instruction_approved":true,"report":{"payload":{"cycle_id":"mock-001","ended_at":"2026-10-30T07:05:37.425558+00:00","results":[{"claim":"n=2, (1,2,2) satisfies integer identity","data":{"factors":{"2":3,"3":2,"5":1},"n":2,"primes":[2,3,5,7,11,13,17,19],"rational":"2","x":1,"y":2,"z":2},"kind":"experiment","verification":"python_exact"}],"started_at":"2026-10-30T07:05:37.420138+00:00","task":"既知の小解の検証のみ"},"revision":3,"sha256":"ec7b6da0d28bda4278be7b1511c1f8806e95307483f90f268c1042670c9c1d8d"},"results":[{"claim":"n=2, (1,2,2) satisfies integer identity","data":{"factors":{"2":3,"3":2,"5":1},"n":2,"primes":[2,3,5,7,11,13,17,19],"rational":"2","x":1,"y":2,"z":2},"kind":"experiment","verification":"python_exact"}],"review":{"comments":"Interface test only; no mathematical review occurred.","cycle_id":"mock-001","next_instruction":"MOCK ONLY: repeat known-solution check","report_revision":3,"report_sha256":"ec7b6da0d28bda4278be7b1511c1f8806e95307483f90f268c1042670c9c1d8d","reviewer":"MOCK ONLY - not ChatGPT","verdict":"accepted"},"revision":4,"schema_version":1,"started_at":"2026-10-30T07:05:37.420138+00:00","status":"reviewed","task":"既知の小解の検証のみ"}],"instruction_approved":true,"report":null,"results":[{"claim":"Interrupted worker; manual diagnosis required","data":{},"kind":"failure","verification":"unreviewed"}],"review":null,"revision":7,"schema_version":1,"started_at":"2026-10-30T07:05:37.452631+00:00","status":"failed","task":"MOCK ONLY: repeat known-solution check"}
